{
  "excluded_columns": [
    "elapsed_seconds",
    "event_id",
    "event_index",
    "game_number",
    "has_rally_length",
    "has_surface",
    "label_match_winner_is_player_a",
    "label_match_winner_player",
    "label_point_winner_is_player_a",
    "label_server_won_point",
    "match_id",
    "p1_score",
    "p2_score",
    "player_a",
    "player_a_rally_length_avg_before",
    "player_b",
    "player_b_rally_length_avg_before",
    "point_number",
    "point_winner_player",
    "rally_length_avg_before",
    "receiver_player",
    "schema_version",
    "server_player",
    "set_number",
    "source_file"
  ],
  "feature_columns": [
    "points_played_before",
    "player_a_points_won_before",
    "player_b_points_won_before",
    "player_a_point_win_pct_before",
    "player_b_point_win_pct_before",
    "server_points_played_before",
    "server_points_won_before",
    "server_point_win_pct_before",
    "receiver_points_played_before",
    "receiver_points_won_before",
    "receiver_point_win_pct_before",
    "player_a_recent_5_win_pct_before",
    "player_b_recent_5_win_pct_before",
    "player_a_recent_10_win_pct_before",
    "player_b_recent_10_win_pct_before",
    "player_a_aces_before",
    "player_b_aces_before",
    "player_a_double_faults_before",
    "player_b_double_faults_before",
    "elapsed_seconds_before",
    "elapsed_seconds_delta_from_prev",
    "is_server_player_a",
    "is_receiver_player_a",
    "has_valid_point_winner",
    "has_valid_server",
    "has_elapsed_seconds"
  ],
  "feature_schema_hash": "b6ee9d5a6a4c6357487a29c1e66293b390d76b471f76610f4fe9232313d4d738",
  "input_dataset": "data/features/point_features",
  "limitations": [
    "Surface features excluded because surface coverage is unavailable.",
    "Rally-length features excluded from the primary MVP model because coverage is sparse.",
    "ATP-derived labels/features excluded because no reliable bridge is validated."
  ],
  "model_type": "odds",
  "random_seed": 42,
  "schema_version": "odds_model_metadata_v1",
  "target_column": "label_point_winner_is_player_a",
  "test_auc": 0.6415344327971061,
  "test_brier_score": 0.2346526207800247,
  "test_row_count": 284868,
  "train_row_count": 300000,
  "trained_at": "2026-05-03T20:25:04Z",
  "training_script": "scripts/train_odds_model.py",
  "validation_auc": 0.639548197813816,
  "validation_brier_score": 0.23509465864335471,
  "validation_row_count": 287565,
  "version": "v1"
}
